Type,Number,Front,Back
Key Point,1,"High Availability Architecture - Deploying instances across multiple Availability Zones (AZs) to ensure application uptime even if one AZ fails.","How does deploying EC2 instances across multiple AZs enhance high availability, and what components are needed?"
Key Point,2,"Elasticity and Scalability - Scaling resources up or down based on demand using Auto Scaling Groups and Load Balancers to optimize costs and performance.","What is the difference between elasticity and scalability, and how does AWS enable both?"
Key Point,3,"Security Best Practices - Implementing IAM roles (not keys), Security Groups, Network ACLs, VPC isolation, encryption at rest and in transit, and regular security audits.","What are the key security best practices for EC2 instances at the Solution Architect level?"
Key Point,4,"Monitoring and Logging Strategy - Using CloudWatch for metrics and alarms, CloudTrail for API logging, VPC Flow Logs for network monitoring, and centralized logging solutions.","How can CloudWatch and CloudTrail be used together for comprehensive monitoring and auditing?"
Key Point,5,"Backup and Disaster Recovery - Creating AMIs and EBS snapshots regularly, implementing cross-region replication, testing recovery procedures, and establishing RTO/RPO requirements.","What backup and disaster recovery strategies should be implemented for EC2-based applications?"
Key Point,6,"VPC Architecture - Designing VPCs with public/private subnets, Internet Gateways, NAT Gateways, Route Tables, and proper network segmentation for security and scalability.","What are the key components of a well-designed VPC architecture in AWS?"
Key Point,7,"Load Balancing Strategy - Implementing Application Load Balancer (ALB) for Layer 7, Network Load Balancer (NLB) for Layer 4, or Classic Load Balancer (CLB) based on requirements.","What are the differences between ALB, NLB, and CLB, and when should each be used?"
Key Point,8,"Cost Optimization - Choosing appropriate pricing models (Reserved vs Spot vs On-Demand), right-sizing instances, using Savings Plans, and implementing cost monitoring and alerts.","What factors should be considered when optimizing EC2 costs, and what tools help with cost management?"
Key Point,9,"Multi-Tier Architecture - Designing applications with separate tiers (web, application, database) in different subnets with appropriate security groups and network ACLs.","How do you design a secure multi-tier EC2 architecture with proper network segmentation?"
Key Point,10,"Storage Strategy - Selecting between EBS (persistent), Instance Store (ephemeral), EFS (shared), FSx (managed file systems) based on durability, performance, and cost requirements.","What factors should be considered when choosing between EBS, Instance Store, and EFS for storage?"
Key Point,11,"Auto Scaling Configuration - Setting up target tracking, step scaling, and simple scaling policies with appropriate CloudWatch alarms, cooldown periods, and lifecycle hooks.","How do you configure Auto Scaling Groups for optimal performance and cost efficiency?"
Key Point,12,"Network Performance Optimization - Using Enhanced Networking, Placement Groups for low latency, and choosing appropriate instance types with sufficient network bandwidth.","What strategies improve EC2 network performance, and how do Placement Groups help?"
Key Point,13,"Disaster Recovery Patterns - Implementing backup and restore, pilot light, warm standby, or multi-site active/active patterns based on RTO/RPO requirements and budget.","What are the different disaster recovery patterns for EC2, and how do they differ in cost and recovery time?"
Key Point,14,"High Performance Computing (HPC) - Using Cluster Placement Groups, enhanced networking, instance types with high network bandwidth, and parallel file systems for HPC workloads.","What EC2 features and configurations are essential for High Performance Computing workloads?"
Key Point,15,"Container Deployment on EC2 - Using Amazon ECS, EKS, or self-managed Kubernetes on EC2 with proper instance types, auto-scaling, and networking configuration.","How do you architect containerized applications on EC2, and what are the deployment options?"
Key Point,16,"Hybrid Cloud Architecture - Connecting on-premises infrastructure to AWS EC2 using VPN, Direct Connect, or AWS VPN with proper security and routing configuration.","What are the options for integrating on-premises infrastructure with EC2 instances in AWS?"
Key Point,17,"Multi-Region Deployment - Deploying EC2 instances across multiple regions for global availability, disaster recovery, and compliance, with proper data replication and routing.","What considerations are important when designing a multi-region EC2 architecture?"
Key Point,18,"Performance Tuning - Right-sizing instances, using appropriate EBS volume types (gp3, io2, io1), optimizing application code, and monitoring performance metrics.","What strategies help optimize EC2 and application performance?"
Key Point,19,"Security Group Best Practices - Implementing least-privilege rules, avoiding overly permissive rules, using security group references, and regularly auditing security group rules.","What are the security group best practices for production EC2 deployments?"
Key Point,20,"Instance Lifecycle Management - Using Systems Manager for patch management, automation documents for routine tasks, and lifecycle policies for AMI management.","How do you manage EC2 instance lifecycle, patching, and maintenance at scale?"
Key Point,21,"Cost and Capacity Planning - Analyzing usage patterns, forecasting capacity needs, using Cost Explorer, and implementing budgets and cost anomaly detection.","What tools and techniques help with EC2 capacity planning and cost forecasting?"
Key Point,22,"Compliance and Governance - Implementing AWS Config for compliance monitoring, using AWS Organizations SCPs, and ensuring proper tagging and resource management.","How do you ensure EC2 deployments meet compliance requirements and governance policies?"
Key Point,23,"Application Modernization - Migrating monolithic applications to microservices on EC2, implementing DevOps practices, and using Infrastructure as Code.","What approaches help modernize legacy applications running on EC2?"
Key Point,24,"Fault Tolerance Design - Designing for single points of failure elimination, implementing health checks, graceful degradation, and circuit breakers.","How do you design EC2 architectures to eliminate single points of failure?"
Key Point,25,"Data Transfer Optimization - Minimizing data transfer costs by using VPC endpoints, CloudFront for static content, and optimizing data transfer between regions and services.","What strategies minimize data transfer costs in EC2 architectures?"
Key Point,26,"Observability and Troubleshooting - Implementing comprehensive logging, distributed tracing, APM tools, and proper CloudWatch dashboards for effective troubleshooting.","What observability tools and practices are essential for troubleshooting EC2-based applications?"
Key Point,27,"Resilience Patterns - Implementing retry logic, exponential backoff, bulkhead patterns, and health checks to ensure application resilience.","What resilience patterns should be implemented in EC2-based applications?"
Key Point,28,"Network Segmentation - Using VPCs, subnets, security groups, and NACLs to create defense-in-depth network security with proper segmentation.","How do you implement proper network segmentation for EC2 instances?"
Key Point,29,"Migration Strategies - Planning lift-and-shift, re-platforming, or re-architecting strategies when migrating workloads to EC2 with proper testing and rollback plans.","What are the different migration strategies for moving workloads to EC2?"
Key Point,30,"Well-Architected Framework Application - Applying the five pillars (Operational Excellence, Security, Reliability, Performance Efficiency, Cost Optimization) specifically to EC2 workloads.","How do you apply the AWS Well-Architected Framework principles to EC2-based architectures?"

